name,iso_code,price,purchase_link,image_url,manufacturer,category,description
무게조절 식기 세트,15 09,25000,https://www.coupang.com/vp/products/example1,https://thumbnail.image.com/weighted-utensils.jpg,보조기기코리아,coupang,손 떨림이 있는 분들을 위한 무게조절 식기 세트입니다. 무게 중심을 조절하여 식사 시 떨림을 최소화합니다.
적응형 숟가락,15 09,15000,https://shopping.naver.com/catalog/example2,https://thumbnail.image.com/adaptive-spoon.jpg,보조기기코리아,naver,손 기능이 제한된 분들을 위한 적응형 숟가락입니다.
접이식 휠체어 경사로,18 30,150000,https://shopping.naver.com/catalog/example3,https://cdn.example.com/ramp.jpg,접근성솔루션,naver,휠체어 사용자가 문턱이나 낮은 계단을 쉽게 넘을 수 있도록 돕는 접이식 경사로입니다.
LED 손전등 지팡이,12 22,35000,https://www.coupang.com/vp/products/example4,https://thumbnail.image.com/led-cane.jpg,안전보조기기,coupang,야간 보행을 위한 LED 조명이 내장된 지팡이입니다.
전동 리프트 체어,12 31,2500000,https://www.coupang.com/vp/products/example5,https://thumbnail.image.com/lift-chair.jpg,전동보조기기,coupang,앉기와 서기를 돕는 전동 리프트 체어입니다.

